{
  "id": "test3",
  "title": "Тест 3 · Напряжения и итерации",
  "description": "dU, δU, модуль напряжения, прямой/обратный ход, сходимость, пересчёт на НН.",
  "questions": [
    {
      "id": "t3-q01",
      "test_id": "test3",
      "type": "formula_choice",
      "topic": "dU",
      "difficulty": 1,
      "stem": "Продольная составляющая падения напряжения в ветви с сопротивлением $R+jX$ при потоке $P+jQ$ в конце ветви:",
      "options": [
        {
          "id": "a",
          "text": "$dU=\\dfrac{P\\,R+Q\\,X}{U}$",
          "correct": true,
          "misconception": null,
          "feedback": "Верно."
        },
        {
          "id": "b",
          "text": "$dU=\\dfrac{P\\,X-Q\\,R}{U}$",
          "correct": false,
          "misconception": "dU_deltaU_swap",
          "feedback": "Составляющие перепутаны: продольная $dU=\\dfrac{PR+QX}{U}$ (вдоль вектора напряжения), поперечная $\\delta U=\\dfrac{PX-QR}{U}$. Для трансформатора получается 14.02 кВ вместо 12.64 кВ."
        },
        {
          "id": "c",
          "text": "$dU=\\dfrac{\\sqrt3\\,(P\\,R+Q\\,X)}{U}$",
          "correct": false,
          "misconception": "sqrt3_factor",
          "feedback": "Формулы записаны для ТРЁХФАЗНОЙ мощности и ЛИНЕЙНОГО напряжения ($S=\\sqrt3 UI$ уже «спрятан» внутри): $\\Delta S=\\dfrac{P^2+Q^2}{U^2}Z$ и $dU=\\dfrac{PR+QX}{U}$. Дополнительный $\\sqrt3$ или множитель 3 не нужен."
        }
      ],
      "explanation": "Продольная (по направлению напряжения): $dU=\\dfrac{PR+QX}{U}$; поперечная: $\\delta U=\\dfrac{PX-QR}{U}$. Формулы уже для линейного напряжения и трёхфазной мощности.",
      "related_step": "dU"
    },
    {
      "id": "t3-q02",
      "test_id": "test3",
      "type": "formula_choice",
      "topic": "U_modulus",
      "difficulty": 2,
      "stem": "Модуль напряжения в начале ветви по напряжению в конце $U_{кон}$ и составляющим падения:",
      "options": [
        {
          "id": "a",
          "text": "$U=\\sqrt{(U_{кон}+dU)^2+\\delta U^2}$",
          "correct": true,
          "misconception": null,
          "feedback": "Верно."
        },
        {
          "id": "b",
          "text": "$U=U_{кон}+dU$",
          "correct": false,
          "misconception": "no_transverse",
          "feedback": "Поперечная составляющая отброшена: $U=U_{кон}+dU$ — это приближение. В эталоне оно даёт 230.64 кВ вместо 231.07 кВ: занижение всего 0.43 кВ (≈ 0.18 %) — для оценки на 220 кВ допустимо, но в точном расчёте нужен модуль $\\sqrt{(U+dU)^2+\\delta U^2}$."
        },
        {
          "id": "c",
          "text": "$U=\\sqrt{(U_{кон}-dU)^2+\\delta U^2}$",
          "correct": false,
          "misconception": "direction_sign",
          "feedback": "Продольная составляющая ПРИБАВЛЯЕТСЯ к $U_{кон}$: в начале ветви (ближе к источнику) напряжение выше. Знак «минус» дал бы напряжение начала ниже конца — обратное физике."
        },
        {
          "id": "d",
          "text": "$U=\\sqrt{(U_{кон}+\\delta U)^2+dU^2}$",
          "correct": false,
          "misconception": "dU_deltaU_swap",
          "feedback": "Составляющие поменяли роли: к $U_{кон}$ прибавляется ПРОДОЛЬНАЯ $dU$, а поперечная $\\delta U$ идёт под корень отдельным слагаемым."
        }
      ],
      "explanation": "Треугольник напряжений: продольная составляющая складывается с $U_{кон}$ по направлению, поперечная — перпендикулярно; модуль — гипотенуза.",
      "related_step": "U_modulus"
    },
    {
      "id": "t3-q03",
      "test_id": "test3",
      "type": "micro_calc",
      "topic": "dU_T",
      "difficulty": 2,
      "stem": "Итерация 1. Мощность в конце трансформаторов $S=41.49+j34.70$ МВА, $R_T=2.81$ Ом, $X_T=76.04$ Ом, напряжение $U=218$ кВ. Найдите $dU_T$ (кВ, 2 знака).",
      "answer": {
        "quantity": "dU_T",
        "iteration": 1,
        "value": 12.6395,
        "unit": "кВ",
        "digits": 2,
        "tolerance_pct": 1
      },
      "explanation": "$dU_T=\\dfrac{41.49\\cdot2.81+34.70\\cdot76.04}{218}=12.64$ кВ.",
      "related_step": "dU"
    },
    {
      "id": "t3-q04",
      "test_id": "test3",
      "type": "micro_calc",
      "topic": "deltaU_T",
      "difficulty": 2,
      "stem": "Для тех же данных найдите поперечную составляющую $\\delta U_T$ (кВ, 2 знака).",
      "answer": {
        "quantity": "deltaU_T",
        "iteration": 1,
        "value": 14.0236,
        "unit": "кВ",
        "digits": 2,
        "tolerance_pct": 1
      },
      "explanation": "$\\delta U_T=\\dfrac{41.49\\cdot76.04-34.70\\cdot2.81}{218}=14.02$ кВ.",
      "related_step": "dU"
    },
    {
      "id": "t3-q05",
      "test_id": "test3",
      "type": "micro_calc",
      "topic": "U2",
      "difficulty": 2,
      "stem": "Итерация 1. $U_{кон}=218$ кВ, $dU_T=12.64$ кВ, $\\delta U_T=14.02$ кВ. Найдите $U_2$ — напряжение на входе трансформаторов (кВ, 1 знак).",
      "answer": {
        "quantity": "U2",
        "iteration": 1,
        "value": 231.065,
        "unit": "кВ",
        "digits": 1,
        "tolerance_pct": 0.1
      },
      "explanation": "$U_2=\\sqrt{(218+12.64)^2+14.02^2}=231.1$ кВ.",
      "related_step": "U_modulus"
    },
    {
      "id": "t3-q06",
      "test_id": "test3",
      "type": "micro_calc",
      "topic": "U1",
      "difficulty": 3,
      "stem": "Итерация 1. Для линии: $dU_л=2.97$ кВ, $\\delta U_л=2.63$ кВ; напряжение в конце линии $U_2=231.1$ кВ. Найдите $U_1$ (кВ, 1 знак).",
      "answer": {
        "quantity": "U1",
        "iteration": 1,
        "value": 234.048,
        "unit": "кВ",
        "digits": 1,
        "tolerance_pct": 0.1
      },
      "explanation": "$U_1=\\sqrt{(231.1+2.97)^2+2.63^2}=234.0$ кВ.",
      "related_step": "U_modulus"
    },
    {
      "id": "t3-q07",
      "test_id": "test3",
      "type": "micro_calc",
      "topic": "U_nn",
      "difficulty": 1,
      "stem": "Напряжение за сопротивлением обмоток (сторона ВН) равно 218 кВ. Найдите напряжение на стороне НН без РПН (кВ, 2 знака): $U_{вн.ном}=230$ кВ, $U_{нн.ном}=11$ кВ.",
      "answer": {
        "quantity": "U_nn",
        "iteration": 1,
        "value": 10.4261,
        "unit": "кВ",
        "digits": 2,
        "tolerance_pct": 1
      },
      "explanation": "$U_{нн}=218\\cdot\\dfrac{11}{230}=10.43$ кВ.",
      "related_step": "U_nn"
    },
    {
      "id": "t3-q08",
      "test_id": "test3",
      "type": "spot_the_error",
      "topic": "no_transverse",
      "difficulty": 2,
      "stem": "Студент нашёл $U_2=218+12.64=230.6$ кВ. Что он упустил?",
      "options": [
        {
          "id": "a",
          "text": "Поперечную составляющую $\\delta U$: точный модуль $\\sqrt{(U+dU)^2+\\delta U^2}$; приближение занижает результат на 0.43 кВ",
          "correct": true,
          "misconception": null,
          "feedback": "Верно."
        },
        {
          "id": "b",
          "text": "Перепутал продольную и поперечную составляющие",
          "correct": false,
          "misconception": "dU_deltaU_swap",
          "feedback": "Составляющие перепутаны: продольная $dU=\\dfrac{PR+QX}{U}$ (вдоль вектора напряжения), поперечная $\\delta U=\\dfrac{PX-QR}{U}$. Для трансформатора получается 14.02 кВ вместо 12.64 кВ."
        },
        {
          "id": "c",
          "text": "Не учёл коэффициент трансформации",
          "correct": false,
          "misconception": "nn_no_ratio",
          "feedback": "Коэффициент трансформации нужен при пересчёте на сторону НН, а здесь считается напряжение на стороне ВН ($U_2$). Причина ошибки — отброшенная $\\delta U$."
        },
        {
          "id": "d",
          "text": "Потери мощности надо было вычесть",
          "correct": false,
          "misconception": "direction_sign",
          "feedback": "Знак потерь мощности тут ни при чём: студент считает напряжение $U_{кон}+dU$. Ошибка — в отброшенной поперечной составляющей $\\delta U$."
        }
      ],
      "explanation": "Точно: $U_2=231.1$ кВ. Отбрасывание $\\delta U$ даёт 230.6 кВ: занижение $\\approx\\delta U^2/(2U)$ — доли кВ.",
      "related_step": "U_modulus"
    },
    {
      "id": "t3-q09",
      "test_id": "test3",
      "type": "spot_the_error",
      "topic": "dU_swap",
      "difficulty": 2,
      "stem": "Студент нашёл продольную составляющую $dU=\\dfrac{P\\,X-Q\\,R}{U}=14.02$ кВ. Где ошибка?",
      "options": [
        {
          "id": "a",
          "text": "Это формула ПОПЕРЕЧНОЙ составляющей $\\delta U$; для $dU$ нужна $\\dfrac{PR+QX}{U}$ (верно: 12.64 кВ)",
          "correct": true,
          "misconception": null,
          "feedback": "Верно."
        },
        {
          "id": "b",
          "text": "Нужно домножить на $\\sqrt3$",
          "correct": false,
          "misconception": "sqrt3_factor",
          "feedback": "Формулы записаны для ТРЁХФАЗНОЙ мощности и ЛИНЕЙНОГО напряжения ($S=\\sqrt3 UI$ уже «спрятан» внутри): $\\Delta S=\\dfrac{P^2+Q^2}{U^2}Z$ и $dU=\\dfrac{PR+QX}{U}$. Дополнительный $\\sqrt3$ или множитель 3 не нужен."
        },
        {
          "id": "c",
          "text": "Надо поставить знак «минус»: потери вычитаются",
          "correct": false,
          "misconception": "direction_sign",
          "feedback": "Знак «−» как раз стоит в формуле поперечной составляющей $\\delta U=\\dfrac{PX-QR}{U}$ — её студент и написал. Ошибка в том, что это формула $\\delta U$, а не $dU$."
        }
      ],
      "explanation": "$dU=\\dfrac{PR+QX}{U}$ — «R при P, X при Q»; $\\delta U=\\dfrac{PX-QR}{U}$ — наоборот, со знаком «минус».",
      "related_step": "dU"
    },
    {
      "id": "t3-q10",
      "test_id": "test3",
      "type": "concept",
      "topic": "transverse_size",
      "difficulty": 3,
      "stem": "Насколько отбрасывание поперечной составляющей $\\delta U$ занижает $U_2$ в эталонной задаче (сеть 220 кВ)?",
      "options": [
        {
          "id": "a",
          "text": "Всего на доли кВ (0.43 кВ): $\\delta U\\ll U$, добавка $\\approx\\delta U^2/(2U)$. Для оценки допустимо, для точного расчёта — нет",